{
  "label": "Phrasal verb",
  "verb": "put off",
  "ask": "Ne demek? Tahmin et",
  "meaning_en": "to postpone; to delay something",
  "meaning_tr": "Ertelemek, sonraya bırakmak",
  "examples": [
    "I keep ==putting off== my IELTS registration.",
    "Don't ==put off== until tomorrow what you can do today.",
    "The meeting was ==put off== to next week."
  ],
  "cta": "Kaydet 🔖 Sen ne erteliyorsun? Yorumla",
  "meta": {
    "topic": "put off",
    "caption": "\"Put off\" ne demek? ⏳\n\nErtelemek! Türkçede \"sonraya bırakmak\" dediğimiz her yerde kullanabilirsin:\n• I keep putting off my IELTS registration.\n• Don't put off until tomorrow what you can do today.\n\nSen en çok neyi erteliyorsun? 😅 Yorumlara yaz 👇\nKaydet, phrasal verb listene ekle 🔖\n\nPhrasal verb of the day: put off = postpone.",
    "hashtags": ["#phrasalverbs", "#ingilizce", "#ahkakademi", "#ielts", "#learnenglish", "#ingilizceöğreniyorum", "#vocabulary", "#englishtips", "#ingilizcekelime", "#speakenglish", "#toefl"],
    "audio_mood": "playful curious beat, little 'ding' on each example"
  }
}
